,title,lprice,mall,link
743,보헤미안 서울 HALTER BOLERO SLEEVE 블랙  NONE,89900,쿠팡,https://search.shopping.naver.com/gate.nhn?id=45240236908
744,DEPOUND 자카드 집업 니트 아이보리  NONE,313700,쿠팡,https://search.shopping.naver.com/gate.nhn?id=45241147372
745,일리고 앙고라 롱 가디건 핑크  none,47500,쿠팡,https://search.shopping.naver.com/gate.nhn?id=45236760926
746,AVANDRESS 레이온 루즈핏 크롭 셔츠화이트  NONE,35900,쿠팡,https://search.shopping.naver.com/gate.nhn?id=45203198548
747,보헤미안 서울 LEATHER BOMBER JUMPER 1 SIZE 블랙  NONE,352700,쿠팡,https://search.shopping.naver.com/gate.nhn?id=45149101330
748,벨벳 트레이닝 여성 겨울 빅사이즈 세트 셋업 츄리닝 트레이닝복 - none,32250,티몬,https://search.shopping.naver.com/gate.nhn?id=44117693339
749,미드나잇무브 플라워 top 화이트  none,42100,쿠팡,https://search.shopping.naver.com/gate.nhn?id=45090166237
750,미드나잇무브 digital 하트 t 아이보리  NONE,58100,쿠팡,https://search.shopping.naver.com/gate.nhn?id=45089988072
751,미드나잇무브 스웨이드 자켓 재킷 카키  NONE,127000,쿠팡,https://search.shopping.naver.com/gate.nhn?id=45089260390
752,미드나잇무브 스웨이드 자켓 재킷 베이지  NONE,127000,쿠팡,https://search.shopping.naver.com/gate.nhn?id=45088520388
753,미드나잇무브 hair 집업 핑크  NONE,71600,쿠팡,https://search.shopping.naver.com/gate.nhn?id=45087843775
754,룩캐스트 블랙 JIMI 컷아웃 니트  none,97200,쿠팡,https://search.shopping.naver.com/gate.nhn?id=45087851930
755,미드나잇무브 cut 니트 가디건 아이보리  NONE,68600,쿠팡,https://search.shopping.naver.com/gate.nhn?id=45069524198
756,미드나잇무브 라인 가죽 자켓 재킷 브라운  NONE,229200,쿠팡,https://search.shopping.naver.com/gate.nhn?id=45068593406
757,미드나잇무브 4 라인 집업 핑크  NONE,83800,쿠팡,https://search.shopping.naver.com/gate.nhn?id=45067548510
758,보헤미안 서울 CLAIC SPENCER JACKET  NONE,210600,쿠팡,https://search.shopping.naver.com/gate.nhn?id=45028614365
759,보헤미안 서울 Y 심볼 롱슬리브 가디건 블랙  NONE,95000,쿠팡,https://search.shopping.naver.com/gate.nhn?id=45004566500
760,수지네 일본 구제 브라운 면 스키니팬츠 여자 S none none,7240,옥션,https://search.shopping.naver.com/gate.nhn?id=43175666477
761,수지네 일본 구제 살구색 h라인스커트 여자 S none none,7490,옥션,https://search.shopping.naver.com/gate.nhn?id=43175690048
762,수지네 구제 브라운 허리밴딩스커트 여자 S 26 none none,5380,옥션,https://search.shopping.naver.com/gate.nhn?id=43175728260
763,수지네 일본 구제 베이지 긴팔니트 여자 S none none,4970,옥션,https://search.shopping.naver.com/gate.nhn?id=43175612998
764,미드나잇무브 오프숄더 니트 퍼플  NONE,75100,쿠팡,https://search.shopping.naver.com/gate.nhn?id=44828129510
765,썸웨어버터 레터 스트라이프 니트 아이보리  NONE,131100,쿠팡,https://search.shopping.naver.com/gate.nhn?id=44828660863
766,미드나잇무브 damage 니트 핑크  none,60900,쿠팡,https://search.shopping.naver.com/gate.nhn?id=44718242120
767,미드나잇무브 ov 가죽 자켓 재킷 블랙  NONE,212100,쿠팡,https://search.shopping.naver.com/gate.nhn?id=44717986293
768,NONE 루즈핏 라운드넥 니트 브이넥 스마일 오버핏,12240,11번가,https://search.shopping.naver.com/gate.nhn?id=42565614098
769,미드나잇무브 벨벳 집업 브라운  none,54200,쿠팡,https://search.shopping.naver.com/gate.nhn?id=44539576068
770,미드나잇무브 아일렛 T 브라운  NONE,64900,쿠팡,https://search.shopping.naver.com/gate.nhn?id=44539304077
771,미드나잇무브 스웨이드 자켓 재킷 핑크  NONE,127000,쿠팡,https://search.shopping.naver.com/gate.nhn?id=44535515970
772,수지네 구제 브라운 허리밴딩스커트 여자 S 26 none none,5390,G마켓,https://search.shopping.naver.com/gate.nhn?id=42344659604
773,수지네 일본 구제 살구색 h라인스커트 여자 S none none,7500,G마켓,https://search.shopping.naver.com/gate.nhn?id=42344693025
774,수지네 구제 그린 면혼방 골덴자켓 여자 S none none,11870,G마켓,https://search.shopping.naver.com/gate.nhn?id=42344887775
775,IMPRINTU 임프린투 Full set  NONE,477900,쿠팡,https://search.shopping.naver.com/gate.nhn?id=44242928998
776,FACE NONE DRAPE BLOUSE (BLACK),345100,위메프,https://search.shopping.naver.com/gate.nhn?id=45389123520
777,FACE NONE DRAPE BLOUSE (WHITE),345100,위메프,https://search.shopping.naver.com/gate.nhn?id=45389137909
778,FACE NONE DRAPE BLOUSE (WHITE),293340,옥션,https://search.shopping.naver.com/gate.nhn?id=45388995777
779,FACE NONE DRAPE BLOUSE (BLACK),293340,옥션,https://search.shopping.naver.com/gate.nhn?id=45388947813
780,FACE NONE DRAPE BLOUSE (WHITE),310590,롯데ON,https://search.shopping.naver.com/gate.nhn?id=45388927253
781,FACE NONE DRAPE BLOUSE (BLACK),310590,롯데ON,https://search.shopping.naver.com/gate.nhn?id=45388890482
782,FACE NONE DRAPE BLOUSE (BLACK),345100,11번가,https://search.shopping.naver.com/gate.nhn?id=45388149028
783,FACE NONE DRAPE BLOUSE (WHITE),345100,11번가,https://search.shopping.naver.com/gate.nhn?id=45386909663
784,FACE NONE DRAPE BLOUSE (WHITE),345100,G마켓,https://search.shopping.naver.com/gate.nhn?id=45386397607
785,FACE NONE DRAPE BLOUSE (BLACK),345100,G마켓,https://search.shopping.naver.com/gate.nhn?id=45385684948
786,FACE NONE DRAPE BLOUSE (WHITE),318600,모던에이A,https://search.shopping.naver.com/gate.nhn?id=87406879879
787,FACE NONE DRAPE BLOUSE (BLACK),318600,모던에이A,https://search.shopping.naver.com/gate.nhn?id=87406875639
788,OHL OH L ROSE PATTERN GOOSE DOWN PUFFER JACKET none,498000,네이버,https://search.shopping.naver.com/gate.nhn?id=37021152453
789,[VERSO] None Collar Cotton Jacket,389000,더블유컨셉,https://search.shopping.naver.com/gate.nhn?id=87252594777
790,벨벳 트레이닝 여성 겨울 세트 셋업 허리 밴딩 츄리닝 트레이닝복 - none,38960,티몬,https://search.shopping.naver.com/gate.nhn?id=44115259642
791,벨벳 트레이닝 여성 겨울 양면 기모 세트 셋업 츄리닝 트레이닝복 - none,31310,티몬,https://search.shopping.naver.com/gate.nhn?id=44115302972
792,룍 큐쫰툥쾡콱쿅-패션마켓8 gpt5369k06b슬랙스 와이드슬랙스 핀턱슬랙el f-kd l tm- NONE L 래 큐동펴쾡 연그레이 Light,57250,네이버,https://search.shopping.naver.com/gate.nhn?id=38945842457
793,수지네 구제 청록색 면혼방 긴팔니트 여자 XL none none,6560,옥션,https://search.shopping.naver.com/gate.nhn?id=45179001099
794,수지네 구제 블랙 울혼방 긴팔니트 여자 XL none none,7240,옥션,https://search.shopping.naver.com/gate.nhn?id=45178837203
795,수지네 일본 구제 블랙 차이나카라자켓 여자 M none none,9760,옥션,https://search.shopping.naver.com/gate.nhn?id=45081185246
796,수지네 일본 구제 브라운 면혼방 스키니팬츠 여자 M none none,10860,옥션,https://search.shopping.naver.com/gate.nhn?id=45081287119
797,수지네 일본 구제 그레이 목폴라긴팔니트 여자 M none none,6390,옥션,https://search.shopping.naver.com/gate.nhn?id=45081466563
798,수지네 일본 구제 블루 A라인스커트 여자 M none none,7490,옥션,https://search.shopping.naver.com/gate.nhn?id=45081397191
799,수지네 구제 차콜 울혼방 롱니트조끼 여자 M none none,4970,옥션,https://search.shopping.naver.com/gate.nhn?id=45081379675
800,수지네 일본 구제 블랙 A라인스커트 여자 M none none,7490,옥션,https://search.shopping.naver.com/gate.nhn?id=45081332502
801,수지네 일본 구제 황토색 A라인스커트 여자 M none none,7490,옥션,https://search.shopping.naver.com/gate.nhn?id=45081246323
802,수지네 일본 구제 블랙 A라인스커트 여자 M none none,7490,옥션,https://search.shopping.naver.com/gate.nhn?id=45081239017
803,수지네 구제 진청 데님 A라인스커트 여자 M none none,7990,옥션,https://search.shopping.naver.com/gate.nhn?id=45081195737
804,수지네 구제 블랙 면혼방 스키니팬츠 여자 M 28 none none,7150,옥션,https://search.shopping.naver.com/gate.nhn?id=45080186588
805,수지네 일본 구제 브라운 면혼방 민소매가디건 여자 S none none,7160,G마켓,https://search.shopping.naver.com/gate.nhn?id=45080459470
806,수지네 일본 구제 차콜 면혼방 롱가디건 여자 XS none none,7160,G마켓,https://search.shopping.naver.com/gate.nhn?id=45080346777
807,수지네 구제 머스타드 브이넥긴팔니트 여자 L 105 none none,3200,옥션,https://search.shopping.naver.com/gate.nhn?id=45080286618
808,수지네 일본 구제 퍼플 긴팔셔츠 여자 S 85 none none,5390,G마켓,https://search.shopping.naver.com/gate.nhn?id=45080250319
809,수지네 구제 아이보리 면혼방 스키니팬츠 여자 M 28 none none,5380,옥션,https://search.shopping.naver.com/gate.nhn?id=45080445487
810,수지네 구제 네이비 울 h라인스커트 여자 XS 23 none none,11870,G마켓,https://search.shopping.naver.com/gate.nhn?id=45080244978
811,수지네 구제 핑크 면혼방 스키니팬츠 여자 M 28 none none,7150,옥션,https://search.shopping.naver.com/gate.nhn?id=45080297778
812,수지네 구제 블랙 면혼방 스키니팬츠 여자 M 28 none none,7160,G마켓,https://search.shopping.naver.com/gate.nhn?id=45079646635
813,수지네 구제 아이보리 면혼방 스키니팬츠 여자 M 28 none none,5390,G마켓,https://search.shopping.naver.com/gate.nhn?id=45079593469
814,수지네 구제 청록색 면혼방 긴팔니트 여자 XL none none,6570,G마켓,https://search.shopping.naver.com/gate.nhn?id=45079638983
815,수지네 일본 구제 오렌지 롱h라인스커트 여자 S none none,10530,G마켓,https://search.shopping.naver.com/gate.nhn?id=45079580553
816,수지네 일본 구제 그린 면혼방 스키니팬츠 여자 S none none,10870,G마켓,https://search.shopping.naver.com/gate.nhn?id=45079384486
817,수지네 일본 구제 블랙 차이나카라자켓 여자 M none none,9770,G마켓,https://search.shopping.naver.com/gate.nhn?id=45079496208
818,수지네 구제 핑크 면혼방 스키니팬츠 여자 M 28 none none,7160,G마켓,https://search.shopping.naver.com/gate.nhn?id=45079608181
819,수지네 구제 머스타드 브이넥긴팔니트 여자 L 105 none none,3210,G마켓,https://search.shopping.naver.com/gate.nhn?id=45079508766
820,수지네 구제 차콜 울혼방 긴팔니트 여자 S none none,7250,G마켓,https://search.shopping.naver.com/gate.nhn?id=45079562186
821,수지네 일본 구제 카키 울 h라인스커트 여자 S none none,8670,G마켓,https://search.shopping.naver.com/gate.nhn?id=45079580936
822,수지네 구제 블랙 면혼방 스키니팬츠 여자 S 26 none none,7150,옥션,https://search.shopping.naver.com/gate.nhn?id=45060532237
823,NONE BINAILY 클래식 퀼팅 가디건 여성 겨울 가을 13421045S2643368227,10390,11번가,https://search.shopping.naver.com/gate.nhn?id=42566309369
824,NONE 여성 토트백 MLNEWANNE L S 니트 탑 A,81120,프리쉽,https://search.shopping.naver.com/gate.nhn?id=42183702877
825,NOFFICIALNOFFICE 엔젤 리본 글로시 패딩 점퍼 실버  NONE,318900,쿠팡,https://search.shopping.naver.com/gate.nhn?id=45388767070
826,미니스커트 가을스커트 여성스커트 NONE 명원 하이웨스트 슬림 체크,75170,직구척척,https://search.shopping.naver.com/gate.nhn?id=84670080878
827,이자벨마랑 23 S SABRINE CURLY 페이크 퍼 쇼츠 코트 None B0060336772 SE0792023463952388SE0792023463952388,1166540,네이버,https://search.shopping.naver.com/gate.nhn?id=44782974409
828,STUDIO 쿼터 집업 디테일 점퍼 Quarter Zip Detail Jumper None 55760569,156411,트렌비,https://search.shopping.naver.com/gate.nhn?id=45314794157
829,NONE 패션트레이닝복 캐쥬얼 운동복 우먼 스프링옷 슬림핏 16511048S2637098975,58470,네이버,https://search.shopping.naver.com/gate.nhn?id=44677785156
830,LOVEFORTY LINE-POINT JERSEY WHITE NONE,132000,쓰리포스트,https://search.shopping.naver.com/gate.nhn?id=86850189210
831,수지네 일본 구제 그레이 목폴라긴팔니트 여자 S none none,3200,옥션,https://search.shopping.naver.com/gate.nhn?id=43175707803
832,수지네 일본 구제 그린 면혼방 스키니팬츠 여자 S none none,10860,옥션,https://search.shopping.naver.com/gate.nhn?id=43175761106
833,수지네 구제 블랙 면혼방 스키니팬츠 여자 S 26 none none,7150,옥션,https://search.shopping.naver.com/gate.nhn?id=43175659320
834,수지네 일본 구제 그레이 A라인스커트 여자 S none none,7490,옥션,https://search.shopping.naver.com/gate.nhn?id=43175706484
835,수지네 일본 구제 카키 울 h라인스커트 여자 S none none,8660,옥션,https://search.shopping.naver.com/gate.nhn?id=43175702947
836,에트오소메 데님 크롭 자켓 스카이블루  none,55950,쿠팡,https://search.shopping.naver.com/gate.nhn?id=45397718611
837,썸웨어버터 letter 니트 - light blue  NONE,98700,쿠팡,https://search.shopping.naver.com/gate.nhn?id=45397645728
838,라운드트리코 홀가먼트 A라인 카디건 브라운  NONE,63300,쿠팡,https://search.shopping.naver.com/gate.nhn?id=45395727904
839,라운드트리코 장미 로고 오픈 카디건 L그린  NONE,68300,쿠팡,https://search.shopping.naver.com/gate.nhn?id=45394887290
840,라운드트리코 벌룬 볼레로 가디건 다크그레이  NONE,50500,쿠팡,https://search.shopping.naver.com/gate.nhn?id=45394770396
841,라운드트리코 홀가먼트 A라인 카디건 블랙  NONE,63300,쿠팡,https://search.shopping.naver.com/gate.nhn?id=45394712104
842,어나더에이 스퀘어넥 볼레로 탑 Cocoa  NONE,52690,쿠팡,https://search.shopping.naver.com/gate.nhn?id=45385481902
843,어글리쉐도우 FLOWER CARDIGAN SET TOP 핑크 BLUE  none,72790,쿠팡,https://search.shopping.naver.com/gate.nhn?id=45385157373
844,NONE 봄계절 모직 빈티지스웨터디자인 배합 얇은 니트 1091439S2157488347,30290,11번가,https://search.shopping.naver.com/gate.nhn?id=42568409491
845,리플레이컨테이너 용기 lap tape mtm 라이트그레이  NONE,52000,쿠팡,https://search.shopping.naver.com/gate.nhn?id=45367641350
846,MONCLER RAIE 나일론 다운 베스트 None B0060390622 (36698396),5123350,리본즈,https://search.shopping.naver.com/gate.nhn?id=44574388027
847,23 S S MONCLER PONTAIX 다운 자켓 None B0060335769 (36698394),4360500,리본즈,https://search.shopping.naver.com/gate.nhn?id=44574309624
848,BALENCIAGA 트위스트 스윙 포플린 셔츠 None B0060311651 (36606740),3156850,리본즈,https://search.shopping.naver.com/gate.nhn?id=44488041747
849,썸웨어버터 포켓 패딩 점퍼 빈티지 레드  NONE,345200,쿠팡,https://search.shopping.naver.com/gate.nhn?id=45293978520
850,CX-G-B-57J  토끼 니트 모피 조끼 숙녀 패션 None,165015,프리쉽,https://search.shopping.naver.com/gate.nhn?id=45270908494
851,미드나잇무브 후드 니트 가디건 다크그레이  NONE,92500,쿠팡,https://search.shopping.naver.com/gate.nhn?id=45240757761
852,NONE 여성 롱 조끼 정장 더블 오피스 빅사이즈 mcq98,13290,11번가,https://search.shopping.naver.com/gate.nhn?id=42566435252
853,수지네 일본 구제 그레이 목폴라긴팔니트 여자 S none none,3210,G마켓,https://search.shopping.naver.com/gate.nhn?id=42344777875
854,수지네 일본 구제 그레이 A라인스커트 여자 S none none,7500,G마켓,https://search.shopping.naver.com/gate.nhn?id=42344566996
855,수지네 구제 블랙 면혼방 스키니팬츠 여자 S 26 none none,7160,G마켓,https://search.shopping.naver.com/gate.nhn?id=42344549854
856,수지네 구제 블랙 면혼방 스키니팬츠 여자 S 26 none none,7160,G마켓,https://search.shopping.naver.com/gate.nhn?id=42344940819
857,수지네 구제 블랙 울혼방 긴팔니트 여자 XL none none,7250,G마켓,https://search.shopping.naver.com/gate.nhn?id=42343908451
858,몽클레어 23 S S MONCLER VILLEREST 나일론 트렌치 코트 None B0060339051,4808000,트렌비,https://search.shopping.naver.com/gate.nhn?id=44200303368
859,몽클레어 23 S S MONCLER STIBIDEN 나일론 트렌치 코트 None B0060329018,3485000,트렌비,https://search.shopping.naver.com/gate.nhn?id=44200685898
860,썸웨어버터 코듀로이 letter 패치 overall 차콜  NONE,203300,쿠팡,https://search.shopping.naver.com/gate.nhn?id=45089671837
861,23 S S BALENCIAGA LOGOMANIA 자카드 셔츠 None B0060305081 (36088208),4987500,리본즈,https://search.shopping.naver.com/gate.nhn?id=44105860796
862,GUCCI GG 자카드 실크 크레페 셔츠 None B0060308669 (36088227),4319650,리본즈,https://search.shopping.naver.com/gate.nhn?id=44105844727
863,[S 당일]논스판 부츠컷 데님 팬츠 none span butscut denim pants,48000,cedarwood,https://search.shopping.naver.com/gate.nhn?id=85966663412
864,[에이리프] Kelly none collar leather jacket_BEIGE,181560,발란,https://search.shopping.naver.com/gate.nhn?id=43902632459
865,[에이리프] Kelly none collar leather jacket_BLACK,181560,발란,https://search.shopping.naver.com/gate.nhn?id=43902718292
866,OURO COTTON DOUBLE CARDIGAN SOFT BLUE  none,182380,쿠팡,https://search.shopping.naver.com/gate.nhn?id=45397888963
867,OURO COTTON DOUBLE CARDIGAN EGG  none,182380,쿠팡,https://search.shopping.naver.com/gate.nhn?id=45397817252
868,FACE NONE DRAPE BLOUSE (WHITE)  L,330400,쿠팡,https://search.shopping.naver.com/gate.nhn?id=45388865574
869,FACE NONE DRAPE BLOUSE (BLACK)  L,330400,쿠팡,https://search.shopping.naver.com/gate.nhn?id=45388755857
870,JULIAPEPE Urban Crop Leather Padding (Brown)  none,114500,쿠팡,https://search.shopping.naver.com/gate.nhn?id=45385320596
871,L.E.E.Y SHIRRING BOLERO PADDING BEIGE  none,127400,쿠팡,https://search.shopping.naver.com/gate.nhn?id=45366725422
872,STUDIO 맥시 셔츠 드레스 지브라 프린트 Maxi Shirt Dress Zebra Print None 68217470,71136,트렌비,https://search.shopping.naver.com/gate.nhn?id=43444630100
873,STUDIO 비치 저지 점프수트 Beach Jersey Bandeau Playsuit None 68209801,26883,트렌비,https://search.shopping.naver.com/gate.nhn?id=43444348990
874,자켓 wadding 패션 패딩 느슨한 여성 여성 none 자켓 후드 화이트 겨울 실크,79820,유닛808,https://search.shopping.naver.com/gate.nhn?id=45134908695
875,LEUNI Round Hem Two Tone Zip KnitBlack  NONE,142900,쿠팡,https://search.shopping.naver.com/gate.nhn?id=45239166446
876,까트린 CATTLINE 스퀘어넥 퍼 니트 티셔츠 머플러 세트 스카이블루 NONE,46000,네이버,https://search.shopping.naver.com/gate.nhn?id=45391622629
877,미드나잇무브 cut 니트 가디건 다크그레이  NONE,68600,쿠팡,https://search.shopping.naver.com/gate.nhn?id=44536959853
878,단일상품 NONE - MIMTHEWARDROBE 크링클 하이넥 아노락핑크 CRINKLE HIGHNECK ANORAKPINK,81530,티몬,https://search.shopping.naver.com/gate.nhn?id=42877688823
879,[누브] None Collar Hidden Jacket - Beige D07SXX00224,153900,LFmall,https://search.shopping.naver.com/gate.nhn?id=36224823634
880,[에이리프] Kelly none collar leather jacket_BEIGE,216000,바바더닷컴,https://search.shopping.naver.com/gate.nhn?id=31027437414
881,수지네 일본 구제 진청 면혼방 스키니진 여자 M 29 none none,7150,옥션,https://search.shopping.naver.com/gate.nhn?id=45178783018
882,수지네 일본 구제 블랙 면혼방 긴팔니트 여자 L none none,6560,옥션,https://search.shopping.naver.com/gate.nhn?id=45178812819
883,수지네 일본 구제 청록색 면혼방 스키니팬츠 여자 M 29 none none,7150,옥션,https://search.shopping.naver.com/gate.nhn?id=45178821379
884,밀리어네어햇 데님 over size 빅 apple hat 흑청  none,54580,쿠팡,https://search.shopping.naver.com/gate.nhn?id=43815638978
885,수지네 일본 구제 버건디 면혼방 긴팔니트 여자 M none none,6560,옥션,https://search.shopping.naver.com/gate.nhn?id=45081264911
886,수지네 일본 구제 아이보리 울혼방 긴팔니트 여자 M none none,7240,옥션,https://search.shopping.naver.com/gate.nhn?id=45081253577
887,수지네 일본 구제 멀티컬러 면 긴팔블라우스 여자 M none none,7240,옥션,https://search.shopping.naver.com/gate.nhn?id=45081362869
888,수지네 일본 구제 그레이 스트라이프 울혼방 롱가디건 여자 M none none,7990,옥션,https://search.shopping.naver.com/gate.nhn?id=45080261532
889,수지네 일본 구제 네이비 면혼방 스키니팬츠 여자 XS 23 none none,7160,G마켓,https://search.shopping.naver.com/gate.nhn?id=45080400199
890,수지네 일본 구제 블랙 A라인스커트 여자 XS 21 none none,10190,G마켓,https://search.shopping.naver.com/gate.nhn?id=45080274542
891,수지네 일본 구제 블랙 울혼방 긴팔니트 여자 XS none none,7250,G마켓,https://search.shopping.naver.com/gate.nhn?id=45079614495
892,수지네 일본 구제 핑크 면혼방 긴팔니트 여자 S none none,6570,G마켓,https://search.shopping.naver.com/gate.nhn?id=45079687142
893,수지네 일본 구제 그레이 스트라이프 울혼방 롱가디건 여자 M none none,8000,G마켓,https://search.shopping.naver.com/gate.nhn?id=45079565153
894,수지네 일본 구제 브라운 울혼방 긴팔니트 여자 XS none none,7250,G마켓,https://search.shopping.naver.com/gate.nhn?id=45079576135
895,수지네 구제 멀티컬러 면혼방 긴팔셔츠 여자 S none none,4980,G마켓,https://search.shopping.naver.com/gate.nhn?id=45079504833
896,수지네 일본 구제 황토색 울 목폴라긴팔니트 여자 S none none,7250,G마켓,https://search.shopping.naver.com/gate.nhn?id=45078613144
897,벨벳 트레이닝 여성 겨울 기모 세트 셋업 남자 커플 츄리닝 트레이닝복 - none,35260,티몬,https://search.shopping.naver.com/gate.nhn?id=44115705025
898,트위드 자켓 크롭 블루 아이보리 리본 정장 하객룩 재킷 - none,93920,티몬,https://search.shopping.naver.com/gate.nhn?id=44115003246
899,썸웨어버터 포켓 패딩 점퍼 라이트블루  NONE,345200,쿠팡,https://search.shopping.naver.com/gate.nhn?id=45020702756
900,VVV 하트 버튼 숏 무스탕 _ 베이지  NONE,289620,쿠팡,https://search.shopping.naver.com/gate.nhn?id=45397829973
901,VVV 하트 버튼 숏 무스탕 _ 블랙  NONE,289620,쿠팡,https://search.shopping.naver.com/gate.nhn?id=45397770335
902,14 STUDIO 유니섹스_파이핑 스트링 후드 [그레이]  none,104300,쿠팡,https://search.shopping.naver.com/gate.nhn?id=45393749342
903,NOCONTENT 윈터 점퍼 _ 블루  none,397700,쿠팡,https://search.shopping.naver.com/gate.nhn?id=45389254494
904,VINCENT NAVY 울 점퍼스커트_다크그레이  NONE,161500,쿠팡,https://search.shopping.naver.com/gate.nhn?id=45385291357
905,VINCENT NAVY 울 점퍼스커트_카멜  NONE,161500,쿠팡,https://search.shopping.naver.com/gate.nhn?id=45385165472
906,MARGARIN FINGERS FLORAL REVERSIBLE PADDING (BEIGE)  NONE,551300,쿠팡,https://search.shopping.naver.com/gate.nhn?id=45385577112
907,아더템포 OTHER TEMPO 에토_토프  NONE,131000,쿠팡,https://search.shopping.naver.com/gate.nhn?id=45239452245
908,MAGPIEROBIN 맥파이로빈 스페이스 가디건(블루) SPACE CARDIGAN(Blue)  none,47300,쿠팡,https://search.shopping.naver.com/gate.nhn?id=45240774558
909,JW앤더슨 해외배송 23 F W JW ANDERSON 로고 자카드 울 니트 지퍼 프론트 후드 None B0060386202,1671020,네이버,https://search.shopping.naver.com/gate.nhn?id=41223250204
910,NONE 겨울 가을 와이드 블러킹 스위트 마린넥 스웨터 풀오버 1001042S2659863981,19360,11번가,https://search.shopping.naver.com/gate.nhn?id=42568688267
911,수지네 일본 구제 핑크 면혼방 긴팔니트 여자 S none none,6560,옥션,https://search.shopping.naver.com/gate.nhn?id=43175651973
912,수지네 일본 구제 옐로우 면혼방 h라인스커트 여자 S none none,5810,옥션,https://search.shopping.naver.com/gate.nhn?id=43175714697
913,아디다스 여성 Terrex Myshelter Primaloft Parley 패딩 아노락 None Dye,120000,클리어스,https://search.shopping.naver.com/gate.nhn?id=87382382255
914,수지네 일본 구제 옐로우 면혼방 h라인스커트 여자 S none none,5820,G마켓,https://search.shopping.naver.com/gate.nhn?id=42344943888
915,수지네 일본 구제 블랙 면혼방 긴팔니트 여자 L none none,6570,G마켓,https://search.shopping.naver.com/gate.nhn?id=42343840922
916,크롭 블라우스,41000,none is immune,https://search.shopping.naver.com/gate.nhn?id=87081268582
917,23 S COSMOGONIE 울 자카드 풀오버 None B0060307317 SE0792023463942321SE0792023463942321,4400450,발란,https://search.shopping.naver.com/gate.nhn?id=44058169208
918,23 S VALIERE 나일론 파카 None B0060339815 SE0792023463968792SE0792023463968792,3699200,발란,https://search.shopping.naver.com/gate.nhn?id=44058122499
919,23 S SOFIA 워싱 린넨 블레이저 None B0060335970 SE0792023463940177SE0792023463940177,1244400,발란,https://search.shopping.naver.com/gate.nhn?id=44058129966
920,23 S SOLOGNE 나일론 파카 None B0060303859 SE0792023464095149SE0792023464095149,3699200,발란,https://search.shopping.naver.com/gate.nhn?id=44058130655
921,23 S FONTIA 체크 울 코트 None B0060337181 SE0792023463952904SE0792023463952904,1056550,발란,https://search.shopping.naver.com/gate.nhn?id=44058092096
922,라운드트리코 체커보드 펄 카디건 모피플 오렌지  NONE,68300,쿠팡,https://search.shopping.naver.com/gate.nhn?id=45394726343
923,보헤미안 서울 레더 봄버 점퍼 1 SIZE 워시 드 그레이  NONE,445000,쿠팡,https://search.shopping.naver.com/gate.nhn?id=45394865911
924,비에이블투 스트라이프 숄더 오픈 셔츠 핑크  NONE,99830,쿠팡,https://search.shopping.naver.com/gate.nhn?id=45390019243
