,title,lprice,mall,link
195,HUG YOUR SKIN 위 러브 홈 후드 집업 애쉬 NONE,119000,네이버,https://search.shopping.naver.com/gate.nhn?id=45390163239
196,미쏘니 23 S S MISSONI 코튼 자카드 니트 패턴 None B0060329636 36630731,480340,네이버,https://search.shopping.naver.com/gate.nhn?id=45013661609
197,수지네 구제 그레이 면혼방 맨투맨 여자 M none none,6560,옥션,https://search.shopping.naver.com/gate.nhn?id=45081386657
198,FACE NONE GRAPHIC-PRINT TURTLENECK TOP MULTI COLOR,156000,네이버,https://search.shopping.naver.com/gate.nhn?id=44043693902
199,FACE NONE GRAPHIC-PRINT TURTLENECK TOP MULTI COLOR,156000,네이버,https://search.shopping.naver.com/gate.nhn?id=44038238818
200,BAR None 티셔츠 The BAR None 인스파이어 윈 앳 라이프 챔피언 그래픽 중금속,47440,네이버,https://search.shopping.naver.com/gate.nhn?id=41073206205
201,GUCCI 캐시미어 니트 탑 W 홀스빗 None B0060308436 (36630741),3804750,리본즈,https://search.shopping.naver.com/gate.nhn?id=44517363200
202,GUCCI 로고 울 자카드 니트 가디건 None B0060310603 (36630507),8024650,리본즈,https://search.shopping.naver.com/gate.nhn?id=44517155623
203,GUCCI 캐시미어 니트 가디건 None B0060311910 (36630880),5801650,리본즈,https://search.shopping.naver.com/gate.nhn?id=44516977489
204,23 S S GUCCI 울 가디건 None B0060307273 (36630532),5143300,리본즈,https://search.shopping.naver.com/gate.nhn?id=44516949830
205,23 S S GUCCI GG 울 가디건 None B0060325528 (36630765),5554650,리본즈,https://search.shopping.naver.com/gate.nhn?id=44517266488
206,GUCCI 로고 울 니트 가디건 None B0060311213 (36630885),8024650,리본즈,https://search.shopping.naver.com/gate.nhn?id=44517314262
207,23 S S GUCCI 울 가디건 None B0060333983 (36630818),5143300,리본즈,https://search.shopping.naver.com/gate.nhn?id=44517332286
208,SAINT LAURENT 니트 스웨터 None B0060318850 (36630887),3441850,리본즈,https://search.shopping.naver.com/gate.nhn?id=44517120998
209,GUCCI 캐시미어 니트 가디건 None B0060309818 (36630750),5801650,리본즈,https://search.shopping.naver.com/gate.nhn?id=44517109517
210,수지네 일본 구제 그레이 면혼방 맨투맨 여자 S none none,6570,G마켓,https://search.shopping.naver.com/gate.nhn?id=45079518750
211,쎄르페 스네이크 타투 크롭티  none,53240,쿠팡,https://search.shopping.naver.com/gate.nhn?id=45397834116
212,보니데 비둘기 스웨이트셔츠 백멜란지  none,46260,쿠팡,https://search.shopping.naver.com/gate.nhn?id=45397631740
213,라운드트리코 레이스 슬리브리스 탑 L그린  NONE,52300,쿠팡,https://search.shopping.naver.com/gate.nhn?id=45394767071
214,라운드트리코 플레인 크롭 나시 바이올렛  NONE,41200,쿠팡,https://search.shopping.naver.com/gate.nhn?id=45393757915
215,FACE NONE GRAPHIC-PRINT TURTLENECK TOP KHAKI MULTI COLOR,156000,네이버,https://search.shopping.naver.com/gate.nhn?id=44043379918
216,어나더에이 미스 릴리 슬리브리스 Black  none,52690,쿠팡,https://search.shopping.naver.com/gate.nhn?id=45385312964
217,어나더에이 미스 릴리 슬리브리스 화이트  none,52690,쿠팡,https://search.shopping.naver.com/gate.nhn?id=45385322675
218,어나더에이 스트라이프 슬림 크롭 후드 네이비  NONE,48640,쿠팡,https://search.shopping.naver.com/gate.nhn?id=45385145916
219,미드나잇무브 23 라인 T 옐로우  none,45100,쿠팡,https://search.shopping.naver.com/gate.nhn?id=45367036106
220,바우프 B 플레임 크롭티 카모  NONE,42900,쿠팡,https://search.shopping.naver.com/gate.nhn?id=45366537496
221,미드나잇무브 w 칼라 mtm 와인  NONE,65700,쿠팡,https://search.shopping.naver.com/gate.nhn?id=45241785521
222,오호스 백 슬릿 저지 후드 차콜  NONE,142900,쿠팡,https://search.shopping.naver.com/gate.nhn?id=45239538938
223,보헤미안 서울 BASIC SLEEVELE CROP TOP KHAKI  NONE,35400,쿠팡,https://search.shopping.naver.com/gate.nhn?id=45238520234
224,미드나잇무브 span 크롭티 T 블랙  none,28470,쿠팡,https://search.shopping.naver.com/gate.nhn?id=45237334771
225,미드나잇무브 span 크롭티 T 화이트  none,28470,쿠팡,https://search.shopping.naver.com/gate.nhn?id=45068493339
226,미드나잇무브 래빗 T 핑크  none,42100,쿠팡,https://search.shopping.naver.com/gate.nhn?id=45065631321
227,미드나잇무브 y2k 후드 카키  none,34600,쿠팡,https://search.shopping.naver.com/gate.nhn?id=44903163788
228,오호스 백 슬릿 저지 후드 그레이  NONE,142900,쿠팡,https://search.shopping.naver.com/gate.nhn?id=44721419078
229,미드나잇무브 w 칼라 mtm 블랙  NONE,65700,쿠팡,https://search.shopping.naver.com/gate.nhn?id=44537089360
230,미드나잇무브 크롭티 무스탕 베이지  NONE,229400,쿠팡,https://search.shopping.naver.com/gate.nhn?id=44539154288
231,미드나잇무브 photo T 블랙  none,41100,쿠팡,https://search.shopping.naver.com/gate.nhn?id=44508856037
232,미드나잇무브 span 크롭티 T 민트  none,31370,쿠팡,https://search.shopping.naver.com/gate.nhn?id=44508192685
233,미드나잇무브 M 핀턱 T 화이트  none,45100,쿠팡,https://search.shopping.naver.com/gate.nhn?id=41049255589
234,미드나잇무브 td T 민트  none,56900,쿠팡,https://search.shopping.naver.com/gate.nhn?id=41049398948
235,미드나잇무브 convex T 그린  none,51000,쿠팡,https://search.shopping.naver.com/gate.nhn?id=41049303257
236,수지네 구제 블랙 면 긴팔티셔츠 여자 XS none none,4550,G마켓,https://search.shopping.naver.com/gate.nhn?id=45079593146
237,수지네 일본 구제 블랙 긴팔티셔츠 여자 XS none none,5480,G마켓,https://search.shopping.naver.com/gate.nhn?id=45079512610
238,수지네 일본 구제 브라운 반폴라티셔츠 여자 S none none,7500,G마켓,https://search.shopping.naver.com/gate.nhn?id=45079580849
239,수지네 구제 블랙 긴팔티셔츠 여자 S 85 none none,6060,G마켓,https://search.shopping.naver.com/gate.nhn?id=45079580902
240,수지네 일본 구제 황토색 긴팔티셔츠 여자 XS none none,3210,G마켓,https://search.shopping.naver.com/gate.nhn?id=45079350609
241,수지네 일본 구제 아이보리 긴팔티셔츠 여자 S none none,3210,G마켓,https://search.shopping.naver.com/gate.nhn?id=45078499196
242,수지네 구제 블랙 긴팔티셔츠 여자 S 85 none none,6050,옥션,https://search.shopping.naver.com/gate.nhn?id=45061515508
243,NONE CHIC 큐트 애니메이션 프린팅맨투맨 드로스트링 15011033S2657198680,15050,11번가,https://search.shopping.naver.com/gate.nhn?id=42567509806
244,수지네 일본 구제 아이보리 긴팔티셔츠 여자 S none none,3200,옥션,https://search.shopping.naver.com/gate.nhn?id=43175665325
245,보헤미안 서울 베이직 딥U 넥 긴팔 아이보리  NONE,44900,쿠팡,https://search.shopping.naver.com/gate.nhn?id=45395746042
246,라운드트리코 플레인 크롭 나시 스카이 블루  NONE,41200,쿠팡,https://search.shopping.naver.com/gate.nhn?id=45394785028
247,라운드트리코 시그니처 로고 크롭 티셔츠 핑크  NONE,41200,쿠팡,https://search.shopping.naver.com/gate.nhn?id=45393743709
248,어나더에이 언발란스 워머 크롭 탑 Light 핑크  NONE,48920,쿠팡,https://search.shopping.naver.com/gate.nhn?id=45385363507
249,어글리쉐도우 BUTTERFLY NECK POINT CROP TOP BLACK  none,68440,쿠팡,https://search.shopping.naver.com/gate.nhn?id=45385467783
250,어나더에이 언발란스 워머 크롭 탑 Dark Beige  NONE,48920,쿠팡,https://search.shopping.naver.com/gate.nhn?id=45385360409
251,어나더에이 엑스 박스 티셔츠 차콜  none,61470,쿠팡,https://search.shopping.naver.com/gate.nhn?id=45385500986
252,어글리쉐도우 BUTTERFLY NECK POINT CROP TOP BEGIE  none,68440,쿠팡,https://search.shopping.naver.com/gate.nhn?id=45385421758
253,BALENCIAGA 올 오버추어 미니 로고 스웨터 None B0060317621 (36630906),9588350,리본즈,https://search.shopping.naver.com/gate.nhn?id=44517241775
254,SAINT LAURENT 비스코스 스웨터 None B0060318651 (36630723),2921250,리본즈,https://search.shopping.naver.com/gate.nhn?id=44517158463
255,보헤미안 서울 BASIC DEEP U NECK LONG SLEEVE IVORY  NONE,44200,쿠팡,https://search.shopping.naver.com/gate.nhn?id=45242159492
256,BALENCIAGA 핏 스트레치 저지 스웨터 None B0060308894 (36395500),1315750,리본즈,https://search.shopping.naver.com/gate.nhn?id=44308126820
257,로제프란츠 플리스 크롭티 후드 Indie 핑크  none,56600,쿠팡,https://search.shopping.naver.com/gate.nhn?id=45070329707
258,OURO COTTON FRINGE SLEEVELESS BLACK  none,115730,쿠팡,https://search.shopping.naver.com/gate.nhn?id=45397855059
259,미드나잇무브 23 라인 T 다크그레이  none,45100,쿠팡,https://search.shopping.naver.com/gate.nhn?id=44725227756
260,수지네 구제 블루 면혼방 긴팔티셔츠 여자 M none none,4540,옥션,https://search.shopping.naver.com/gate.nhn?id=45081370235
261,수지네 일본 구제 카키 면 긴팔티셔츠 여자 XS none none,3210,G마켓,https://search.shopping.naver.com/gate.nhn?id=45079635808
262,수지네 일본 구제 블루 면 긴팔티셔츠 여자 S none none,3210,G마켓,https://search.shopping.naver.com/gate.nhn?id=45079365357
263,수지네 구제 네이비 면혼방 긴팔티셔츠 여자 S none none,8000,G마켓,https://search.shopping.naver.com/gate.nhn?id=45079505116
264,수지네 일본 구제 멀티컬러 긴팔티셔츠 여자 XS none none,3210,G마켓,https://search.shopping.naver.com/gate.nhn?id=45079501190
265,수지네 구제 그레이 면혼방 긴팔티셔츠 여자 S none none,4550,G마켓,https://search.shopping.naver.com/gate.nhn?id=45079509873
266,수지네 일본 구제 그레이 면 긴팔티셔츠 여자 XS none none,3210,G마켓,https://search.shopping.naver.com/gate.nhn?id=45079374223
267,NONFORMAL HAUS Incision Over Sweatshirt (Navy)  NONE,105700,쿠팡,https://search.shopping.naver.com/gate.nhn?id=45385405915
268,썸웨어버터 SOMEWHEREBUTTER 1 24 essential turtleneck logo top - NONE,36550,네이버,https://search.shopping.naver.com/gate.nhn?id=44708472711
269,OPENING SUNSHINE 부클 하프 울코트 Boucle Half Wool Coat NONE,165200,네이버,https://search.shopping.naver.com/gate.nhn?id=43782396985
270,수지네 일본 구제 자주색 목폴라긴팔티셔츠 여자 S none none,7490,옥션,https://search.shopping.naver.com/gate.nhn?id=43175663752
271,코튼 저지 스포츠 브라 None B0060312171 SE0792023463942928SE0792023463942928,1177250,발란,https://search.shopping.naver.com/gate.nhn?id=44528909179
272,23 S 코튼 폴로 셔츠 None B0060332105 SE0792023463942653SE0792023463942653,1177250,발란,https://search.shopping.naver.com/gate.nhn?id=44528844510
273,23 S 코튼 티셔츠 None B0060331234 SE0792023463974367SE0792023463974367,872100,발란,https://search.shopping.naver.com/gate.nhn?id=44528868157
274,23 S 로고 스트레치 벨벳 브라 None B0060340420 SE0792023463941355SE0792023463941355,634950,발란,https://search.shopping.naver.com/gate.nhn?id=44528904844
275,23 S 테니스 ACADEMY 크롭 폴로 None B0060323418 SE0792023463979971SE0792023463979971,781150,발란,https://search.shopping.naver.com/gate.nhn?id=44528858185
276,23 S 프린트 티셔츠 None B0060332065 SE0792023463976210SE0792023463976210,1507900,발란,https://search.shopping.naver.com/gate.nhn?id=44528912847
277,23 S 코튼 티셔츠 None B0060339283 SE0792023463941477SE0792023463941477,1439900,발란,https://search.shopping.naver.com/gate.nhn?id=44528901899
278,크롭 로고 프린트 코튼 티셔츠 None B0060309038 SE0792023463966762SE0792023463966762,462400,발란,https://search.shopping.naver.com/gate.nhn?id=44528895935
279,23 S LYLITH 캐시미어 스웨터 None B0060304269 SE0792023463941344SE0792023463941344,2283100,발란,https://search.shopping.naver.com/gate.nhn?id=44528889977
280,빈티지 로고 코튼 저지 티셔츠 None B0060316549 SE0792023463975595SE0792023463975595,1388050,발란,https://search.shopping.naver.com/gate.nhn?id=44528892029
281,오버사이즈 코튼 티셔츠 None B0060310820 SE0792023463939042SE0792023463939042,1177250,발란,https://search.shopping.naver.com/gate.nhn?id=44528839410
282,GG 엠브로이드 쉬어 튈 바디수트 None B0060307845 SE0792023463947368SE0792023463947368,2273750,발란,https://search.shopping.naver.com/gate.nhn?id=44528877722
283,23 S 코튼 폴로 셔츠 None B0060331686 SE0792023463973648SE0792023463973648,1490050,발란,https://search.shopping.naver.com/gate.nhn?id=44528894084
284,23 S 코튼 티셔츠 None B0060322425 SE0792023463939762SE0792023463939762,889100,발란,https://search.shopping.naver.com/gate.nhn?id=44528860225
285,23 S 로고 스트레치 벨벳 브라 None B0060336936 SE0792023463942198SE0792023463942198,651950,발란,https://search.shopping.naver.com/gate.nhn?id=44528884017
286,23 S 코튼 티셔츠 None B0060327440 SE0792023463940290SE0792023463940290,889100,발란,https://search.shopping.naver.com/gate.nhn?id=44528864009
287,미디엄 핏 엠브로이드 코튼 티셔츠 None B0060320730 SE0792023463975193SE0792023463975193,1756950,발란,https://search.shopping.naver.com/gate.nhn?id=44528873205
288,폴리티컬 캠패인 코튼 티셔츠 None B0060317859 SE0792023463951553SE0792023463951553,1671950,발란,https://search.shopping.naver.com/gate.nhn?id=44528875982
289,23 S 실크 사틴 탑 None B0060322403 SE0792023463939741SE0792023463939741,898450,발란,https://search.shopping.naver.com/gate.nhn?id=44528835594
290,23 S 코튼 폴로 셔츠 None B0060326521 SE0792023463951231SE0792023463951231,803250,발란,https://search.shopping.naver.com/gate.nhn?id=44528782375
291,MAISON 발렌시아가 코튼 티셔츠 None B0060307979 SE0792023463980949SE0792023463980949,1671950,발란,https://search.shopping.naver.com/gate.nhn?id=44528803597
292,23 S 코튼 티셔츠 None B0060325929 SE0792023463940562SE0792023463940562,889100,발란,https://search.shopping.naver.com/gate.nhn?id=44528846173
293,23 S 코튼 폴로 셔츠 None B0060334409 SE0792023463952389SE0792023463952389,1177250,발란,https://search.shopping.naver.com/gate.nhn?id=44528881201
294,니트 탱크 탑 바디수트 None B0060309639 SE0792023463939018SE0792023463939018,2852600,발란,https://search.shopping.naver.com/gate.nhn?id=44528785445
295,폴리티컬 캠패인 코튼 티셔츠 None B0060312002 SE0792023463960963SE0792023463960963,1671950,발란,https://search.shopping.naver.com/gate.nhn?id=44528850247
296,23 S 코튼 티셔츠 None B0060330347 SE0792023463962174SE0792023463962174,872100,발란,https://search.shopping.naver.com/gate.nhn?id=44528897853
297,저지 바디수트 None B0060317641 SE0792023463974142SE0792023463974142,6139550,발란,https://search.shopping.naver.com/gate.nhn?id=44528866066
298,MAISON 발렌시아가 코튼 티셔츠 None B0060308022 SE0792023463956540SE0792023463956540,1155150,발란,https://search.shopping.naver.com/gate.nhn?id=44528847175
299,오프 코튼 블렌드 저지 티셔츠 None B0060311074 SE0792023463970691SE0792023463970691,725050,발란,https://search.shopping.naver.com/gate.nhn?id=44528882958
300,23 S 코튼 폴로 셔츠 None B0060334409 SE0792023463952389SE0792023463952389,1177250,발란,https://search.shopping.naver.com/gate.nhn?id=44528881201
301,빈티지 로고 코튼 저지 티셔츠 None B0060318366 SE0792023463973628SE0792023463973628,1244400,발란,https://search.shopping.naver.com/gate.nhn?id=44528858203
302,로고 코튼 저지 티셔츠 None B0060309393 SE0792023463982008SE0792023463982008,1671950,발란,https://search.shopping.naver.com/gate.nhn?id=44528799271
303,Its None of Your Business 여성용 반팔 티셔츠 코튼 O넥 티셔츠 캐주얼 티셔츠,16740,네이버,https://search.shopping.naver.com/gate.nhn?id=40520702024
304,BAR None 티셔츠 최고의 아이콘 바 인스파이어 윈 앳 라이프 쉴드 그래픽 연회색,47440,네이버,https://search.shopping.naver.com/gate.nhn?id=41054471092
305,쓰리투에이티 SPORT CREW NECK JERSEY TOP CREAM  none,98310,쿠팡,https://search.shopping.naver.com/gate.nhn?id=45397678634
306,쓰리투에이티 CARGO CROPPED 후드티 집업 PASTEL GREEN  none,157900,쿠팡,https://search.shopping.naver.com/gate.nhn?id=45397595185
307,NORNOT 오버핏 오리지날 크롭 블루 스웻셔츠  none,198800,쿠팡,https://search.shopping.naver.com/gate.nhn?id=45395746628
308,라운드트리코 시그니처 로고 크롭 티셔츠 화이트 스카이  NONE,41200,쿠팡,https://search.shopping.naver.com/gate.nhn?id=45394850321
309,라운드트리코 시그니처 로고 크롭 티셔츠 화이트 그린  NONE,41200,쿠팡,https://search.shopping.naver.com/gate.nhn?id=45394788943
310,비에이블투 트와이스 레오파드 티셔츠 베이지  NONE,48220,쿠팡,https://search.shopping.naver.com/gate.nhn?id=45390007755
311,RAD RED 블랙 :D 퍼플 스마일 스웻셔츠  NONE,70000,쿠팡,https://search.shopping.naver.com/gate.nhn?id=45385257550
312,낫유어로즈 제니 랩 티셔츠 아이보리  none,87900,쿠팡,https://search.shopping.naver.com/gate.nhn?id=45367427243
313,카사블랑카 23 F/W LES 엘레먼트 오가닉 코튼 티셔츠 None B0060389921,380880,롯데ON,https://search.shopping.naver.com/gate.nhn?id=45278120590
314,23 S S VERSACE 비스코스 리프 니트 점퍼 None B0060339269 (36558749),1520000,리본즈,https://search.shopping.naver.com/gate.nhn?id=44517359704
315,23 S S BURBERRY CRISTIANA 크레스트 니트 후드 None B0060340167 (36631508),3916850,리본즈,https://search.shopping.naver.com/gate.nhn?id=44517233680
316,23 F W KHAITE 조 캐시미어 스웨터 None B0060342889 (36630660),2660950,리본즈,https://search.shopping.naver.com/gate.nhn?id=44516998462
317,수지네 일본 구제 자주색 면혼방 긴팔티셔츠 여자 XS none none,5480,G마켓,https://search.shopping.naver.com/gate.nhn?id=45079508011
318,수지네 일본 구제 블랙 면혼방 긴팔티셔츠 여자 XS none none,3210,G마켓,https://search.shopping.naver.com/gate.nhn?id=45079344356
319,NONE 일선 거물급 마름질 여성패션 봄가을 라운드넥 자수 11141216S2615129970,7920,11번가,https://search.shopping.naver.com/gate.nhn?id=42567126750
320,23 S 슬림 코튼 크롭 티셔츠 None B0060305080 SE0792023463954264SE0792023463954264,1122000,발란,https://search.shopping.naver.com/gate.nhn?id=44528918668
321,23 S 저지 드레이프 바디 W 후드 None B0060338007 SE0792023463941893SE0792023463941893,1190850,발란,https://search.shopping.naver.com/gate.nhn?id=44528801302
322,23 F W 코튼 저지 티셔츠 None B0060342809 SE0792023463948518SE0792023463948518,1212100,발란,https://search.shopping.naver.com/gate.nhn?id=44528892059
323,로고 프린트 미디엄 핏 저지 티셔츠 None B0060316877 SE0792023463971094SE0792023463971094,1756950,발란,https://search.shopping.naver.com/gate.nhn?id=44528907025
324,오버사이즈 프린트 코튼 티셔츠 None B0060311894 SE0792023463943092SE0792023463943092,1050600,발란,https://search.shopping.naver.com/gate.nhn?id=44528864363
325,23 S 로고 프린트 코튼 티셔츠 None B0060330409 SE0792023463976907SE0792023463976907,1507900,발란,https://search.shopping.naver.com/gate.nhn?id=44528799197
326,23 S 미디엄 핏 코튼 티셔츠 None B0060338123 SE0792023463941886SE0792023463941886,1671950,발란,https://search.shopping.naver.com/gate.nhn?id=44528922849
327,23 S 미디엄 핏 코튼 티셔츠 None B0060324077 SE0792023463962760SE0792023463962760,1756950,발란,https://search.shopping.naver.com/gate.nhn?id=44528871085
328,23 S LIMONE 스트라이프 니트 티셔츠 None B0060337709 SE0792023463946125SE0792023463946125,669800,발란,https://search.shopping.naver.com/gate.nhn?id=44528890943
329,23 S 로고 코튼 저지 티셔츠 None B0060323280 SE0792023463981082SE0792023463981082,1155150,발란,https://search.shopping.naver.com/gate.nhn?id=44528762417
330,23 S S VERSACE 그릭 비스코스 블렌드 니트 가디건 None B0060304758 (36630478),1916150,리본즈,https://search.shopping.naver.com/gate.nhn?id=44517371401
331,23 S S THEORY RICKRACK 리브드 코튼 블렌드 스웨터 None B0060334089 (36630882),504450,리본즈,https://search.shopping.naver.com/gate.nhn?id=44517301720
332,23 S S BALENCIAGA SECOND 스킨 스트레치 테크 스웨터 None B0060331573 (36630735),3723050,리본즈,https://search.shopping.naver.com/gate.nhn?id=44517047522
333,23 S S TOM FORD 리브드 니트 탑 None B0060331397 (36630531),3271800,리본즈,https://search.shopping.naver.com/gate.nhn?id=44517344771
334,23 S S SAINT LAURENT 비스코스 니트 탑 None B0060304139 (36631034),2921250,리본즈,https://search.shopping.naver.com/gate.nhn?id=44517058385
335,23 S S BALMAIN 버튼 비스코스 RIB 니트 가디건 None B0060340548 (36630772),5512850,리본즈,https://search.shopping.naver.com/gate.nhn?id=44517118532
336,23 S S JACQUEMUS 르 가디건 BANDO 가디건 W 버튼 None B0060332408 (36630815),689700,리본즈,https://search.shopping.naver.com/gate.nhn?id=44516968514
337,23 S S MONCLER 울 터틀넥 스웨터 None B0060333178 (36630831),2280000,리본즈,https://search.shopping.naver.com/gate.nhn?id=44517019796
338,23 F W THEORY HANELEE 울 캐시미어 가디건 None B0060388282 (36521927),1269200,리본즈,https://search.shopping.naver.com/gate.nhn?id=44409353004
339,BALENCIAGA 올 오버추어 미니 로고 코튼 블렌드 스웨터 None B0060310103 (36110532),4043200,리본즈,https://search.shopping.naver.com/gate.nhn?id=44125826638
340,STUDIO 프린트 티셔츠 Auto Parts Print Cobalt TShirt None 68190001,33453,트렌비,https://search.shopping.naver.com/gate.nhn?id=43846921382
341,BAR None T-Shirt The Icon BAR None Motivate Inspire Win at Life Shield Graphic Larg,47440,네이버,https://search.shopping.naver.com/gate.nhn?id=41373106150
342,BAR None T-Shirt The Icon BAR None Motivate Inspire Win at Life Shield Graphic 2X,47440,네이버,https://search.shopping.naver.com/gate.nhn?id=41099663208
343,수지네 일본 구제 다크그레이 스트라이프 긴팔티셔츠 여자 M 90 none none,3200,옥션,https://search.shopping.naver.com/gate.nhn?id=45179101395
344,Your New Russian Sleeveless Business Cyrillic of None Top Weekend Print Summer Arrival Vest Women am,27790,네이버,https://search.shopping.naver.com/gate.nhn?id=45104439435
345,23 S KOLDI 로고 프린트 린넨 티셔츠 None B0060340082 SE0792023463960928SE0792023463960928,604350,발란,https://search.shopping.naver.com/gate.nhn?id=44528849028
346,23 F W ADEMA 코튼 CROCHET 바디수트 None B0060387757 SE0792023463942480SE0792023463942480,1986450,발란,https://search.shopping.naver.com/gate.nhn?id=44528899082
347,23 S 로고 프린트 스트레치 라이크라 티셔츠 None B0060332411 SE0792023463970975SE0792023463970975,209950,발란,https://search.shopping.naver.com/gate.nhn?id=44528854260
348,23 S 크롭 레이스 패널 코튼 티셔츠 None B0060334065 SE0792023463953092SE0792023463953092,3073600,발란,https://search.shopping.naver.com/gate.nhn?id=44528881333
349,23 F W UPSIDE 다운 코튼 티셔츠 None B0060316906 SE0792023464009270SE0792023464009270,2181950,발란,https://search.shopping.naver.com/gate.nhn?id=44528911126
350,23 S NOT DOING SHIT 코튼 티셔츠 None B0060304580 SE0792023463981153SE0792023463981153,836400,발란,https://search.shopping.naver.com/gate.nhn?id=44528911940
351,23 F W EMMYLOU 코튼 저지 티셔츠 None B0060342660 SE0792023463983116SE0792023463983116,829600,발란,https://search.shopping.naver.com/gate.nhn?id=44528890218
352,23 F W 폴리티컬 캠패인 코튼 티셔츠 None B0060310544 SE0792023463958496SE0792023463958496,1671950,발란,https://search.shopping.naver.com/gate.nhn?id=44528845421
353,23 F W 70S 로고 코튼 티셔츠 None B0060343378 SE0792023463963114SE0792023463963114,1524050,발란,https://search.shopping.naver.com/gate.nhn?id=44528900796
354,23 S S MONCLER 울 블렌드 크루넥 스웨터 None B0060327333 (36630528),2316100,리본즈,https://search.shopping.naver.com/gate.nhn?id=44517172713
355,23 F W THEORY 쇼츠 슬리브 니트 캐시미어 스웨터 None B0060387716 (36630685),905350,리본즈,https://search.shopping.naver.com/gate.nhn?id=44517127449
356,23 S S BALENCIAGA 올오버 로고 크롭 코튼 스웨터 None B0060334846 (36630658),3662250,리본즈,https://search.shopping.naver.com/gate.nhn?id=44517217196
357,23 S S MARINE SERRE POINTELLE 니트 크롭 가디건 None B0060335207 (36630481),796100,리본즈,https://search.shopping.naver.com/gate.nhn?id=44517058877
358,23 S S BALENCIAGA 올오버 로고 코튼 블렌드 가디건 None B0060337188 (36630877),4720550,리본즈,https://search.shopping.naver.com/gate.nhn?id=44517227370
359,23 S S BALENCIAGA 올오버 로고 코튼 블렌드 맨투맨 None B0060340427 (36631066),4381400,리본즈,https://search.shopping.naver.com/gate.nhn?id=44517274986
360,23 S S GUCCI 소프트 울 로고 자카드 니트 탑 None B0060337367 (36630485),4525800,리본즈,https://search.shopping.naver.com/gate.nhn?id=44516983678
361,23 S S MAX MARA COLONIA CROCHET 스트라이프 베스트 None B0060328441 (36281502),431300,리본즈,https://search.shopping.naver.com/gate.nhn?id=44234121107
362,23 S S LORO PIANA PARKSVILLE 베이비 캐시미어 스웨터 None B0060339141 (36226988),5348500,리본즈,https://search.shopping.naver.com/gate.nhn?id=44211415285
363,NONE 신상품 여자 여성 봄 여름 흰 흰색 티셔츠 쫄티 반팔 배꼽 49,21820,11번가,https://search.shopping.naver.com/gate.nhn?id=41199610582
364,23 F W MONCLER 로고 울 크루넥 스웨터 None B0060386438 (36630740),2485200,리본즈,https://search.shopping.naver.com/gate.nhn?id=44517312121
365,23 F W MONCLER CICLISTA ULTRA 파인 울 니트 스웨터 None B0060383001 (36630637),2485200,리본즈,https://search.shopping.naver.com/gate.nhn?id=44517349655
