,title,lprice,mall,link
366,23 S S ALEXANDER WANG 장식 크롭 코튼 블렌드 가디건 None B0060336345 (36630724),1101050,리본즈,https://search.shopping.naver.com/gate.nhn?id=44517246557
367,23 S S MAX MARA MADIA 스트라이프 린넨 블렌드 스웨터 None B0060325854 (36630719),722950,리본즈,https://search.shopping.naver.com/gate.nhn?id=44517263306
368,23 S 실크 바디수트 W 쉬어 인서트 None B0060330166 SE0792023463944190SE0792023463944190,3331150,발란,https://search.shopping.naver.com/gate.nhn?id=44528869098
369,23 F W 라지 핏 엠브로이드 코튼 티셔츠 None B0060310412 SE0792023463965750SE0792023463965750,1671950,발란,https://search.shopping.naver.com/gate.nhn?id=44528821607
370,23 S GG 슈프림 코튼 루렉스 니트 스웨터 None B0060338156 SE0792023463942330SE0792023463942330,2408050,발란,https://search.shopping.naver.com/gate.nhn?id=44528908246
371,23 F W 로고 패치 스트레치 저지 티셔츠 None B0060304267 SE0792023463947367SE0792023463947367,1122000,발란,https://search.shopping.naver.com/gate.nhn?id=44528842378
372,23 F W CHILLAX 폭스 패치 코튼 티셔츠 None B0060325684 SE0792023463977168SE0792023463977168,372300,발란,https://search.shopping.naver.com/gate.nhn?id=44528891792
373,23 F W VALIDO 프린트 코튼 저지 티셔츠 None B0060341313 SE0792023463947696SE0792023463947696,889100,발란,https://search.shopping.naver.com/gate.nhn?id=44528890899
374,23 F W 에센셜 SHRUNK 코튼 저지 티셔츠 None B0060321127 SE0792023463948781SE0792023463948781,613700,발란,https://search.shopping.naver.com/gate.nhn?id=44528919680
375,23 F W CHILLAX 폭스 패치 코튼 티셔츠 None B0060325798 SE0792023463946538SE0792023463946538,372300,발란,https://search.shopping.naver.com/gate.nhn?id=44528912903
376,23 F W 에센셜 SHRUNK 코튼 저지 티셔츠 None B0060386426 SE0792023463981883SE0792023463981883,613700,발란,https://search.shopping.naver.com/gate.nhn?id=44528883973
377,SAINT LAURENT 실크 니트 터틀넥 티셔츠 None B0060316978 (36521929),3116950,리본즈,https://search.shopping.naver.com/gate.nhn?id=44409314239
378,23 S S MAX MARA BOSH 코튼 자카드 니트 베스트 None B0060336426 (36193692),431300,리본즈,https://search.shopping.naver.com/gate.nhn?id=44202123628
379,LAULEA AKOAKOA WOMENS TANK TOP 100 COTTON INNER CUP PADDED NONE SIMPLE PLAIN,39650,프리쉽,https://search.shopping.naver.com/gate.nhn?id=43415854346
380,23 S S ISABEL MARANT LISE 벨벳 니트 비스코스 블렌드 스웨터 None B0060330281 (36630788),1347100,리본즈,https://search.shopping.naver.com/gate.nhn?id=44517260449
381,23 F W MISSONI 실크 캐시미어 니트 크루넥 스웨터 None B0060385709 (36631139),2653350,리본즈,https://search.shopping.naver.com/gate.nhn?id=44517273242
382,23 F W MAX MARA ANANAS 울 캐시미어 니트 후드 None B0060340923 (36630782),3250900,리본즈,https://search.shopping.naver.com/gate.nhn?id=44517158105
383,23 F W MAX MARA LUPPOLO 울 캐시미어 니트 후드 None B0060387130 (36631091),2178350,리본즈,https://search.shopping.naver.com/gate.nhn?id=44517209006
384,23 S S VIVIENNE WESTWOOD 비 로고 울 실크 니트 탑 None B0060338041 (36630477),614650,리본즈,https://search.shopping.naver.com/gate.nhn?id=44517096377
385,23 S S TOM FORD 캐시미어 실크 사틴 브이넥 니트 스웨터 None B0060336775 (36630560),2400650,리본즈,https://search.shopping.naver.com/gate.nhn?id=44516941862
386,파르티멘토 우먼 논 카라 부클 집업 자켓 NONE카라ED BOUCLE,109620,네이버,https://search.shopping.naver.com/gate.nhn?id=43963494789
387,23 F W 폭스 헤드 패치 코튼 티셔츠 None B0060331931 SE0792023463973737SE0792023463973737,338300,발란,https://search.shopping.naver.com/gate.nhn?id=44528750482
388,23 F W TOM FORD 캐시미어 실크 V 넥 니트 스웨터 None B0060343496 (36630654),3620450,리본즈,https://search.shopping.naver.com/gate.nhn?id=44517340318
389,23 F W TOM FORD RIB 니트 비스코스 터틀넥 None B0060343419 (36630807),2636250,리본즈,https://search.shopping.naver.com/gate.nhn?id=44517171170
390,23 S S BRUNELLO CUCINELLI 코튼 니트 스트라이프 크루넥 스웨터 None B0060334588 (36558752),2111850,리본즈,https://search.shopping.naver.com/gate.nhn?id=44516982565
391,여성용 귀여운 고양이 프린트 티셔츠 반팔 하라주쿠 동물 소녀 상의 티 3D 패션 여름 - None,19100,티몬,https://search.shopping.naver.com/gate.nhn?id=40821769934
392,23 F W MAX MARA STRESA 울 니트 터틀넥 스웨터 None B0060385842 (36630825),1645400,리본즈,https://search.shopping.naver.com/gate.nhn?id=44517130634
393,23 S S BRUNELLO CUCINELLI 코튼 오픈 니트 크루넥 오버추어 베스트 None B0060339563 (36630480),1400300,리본즈,https://search.shopping.naver.com/gate.nhn?id=44516982774
394,23 S A P C 로고 프린트 코튼 저지 티셔츠 None B0060327951 SE0792023463963710SE0792023463963710,330650,발란,https://search.shopping.naver.com/gate.nhn?id=44528895860
395,NONE 빈티지 스트라이프 반팔티셔츠 여성자수상의 2022년 여름 신상 숏패션 니트,119630,자파상인,https://search.shopping.naver.com/gate.nhn?id=84463653419
396,여성용 긴 소매 티셔츠  블랙 티셔츠  Tip Meme King but Thats None of My Business 2,31320,프리쉽,https://search.shopping.naver.com/gate.nhn?id=44502156201
397,모이아 MOIA alpaca coat NONE,408000,네이버,https://search.shopping.naver.com/gate.nhn?id=44309309230
398,Other Crew neck Pullover Regular None T-Shirts 여름 기타 빈티지 폴리에스테르 긴 소매 여성  풀오버  운동  액티비티  안전한  내구성,30645,프리쉽,https://search.shopping.naver.com/gate.nhn?id=40381009429
399,파르티멘토 우먼 논 카라 부클 집업 자켓 NONE-카라ED BOUCLE,109620,네이버,https://search.shopping.naver.com/gate.nhn?id=43820702956
400,낫유어로즈 NOT YOUR ROSE 리브 니트 볼레로 세트 Liv knit bolero set NONE,121680,네이버,https://search.shopping.naver.com/gate.nhn?id=44186779276
401,DEPOUND 리버시블 스웨이드 무스탕 [브라운] reversible suede mustang - brown  NONE,415300,쿠팡,https://search.shopping.naver.com/gate.nhn?id=45240035686
402,ILLIGO 일리고 IG JOGGER PANTS none,31500,네이버,https://search.shopping.naver.com/gate.nhn?id=41359909811
403,MESHARE 새로운 None 양 가죽 반바지 G7,99360,네이버,https://search.shopping.naver.com/gate.nhn?id=45215592184
404,ILLIGO 일리고 ANGORA SHORTS none,28800,네이버,https://search.shopping.naver.com/gate.nhn?id=39403918921
405,허그유어스킨 퍼 롱 후드집업 카키 NONE 157320,119000,네이버,https://search.shopping.naver.com/gate.nhn?id=45265721084
406,어글리쉐도우 HOODED REVERSIBLE SHEARLING 자켓 NONE,219000,네이버,https://search.shopping.naver.com/gate.nhn?id=44712636584
407,하렘팬츠 여자 알라딘바지 린넨 요가 바지 태국옷 - NONE,24080,네이버,https://search.shopping.naver.com/gate.nhn?id=40963133736
408,FACE NONE WIDE DETAIL PANTS,218000,네이버,https://search.shopping.naver.com/gate.nhn?id=44126868183
409,FACE NONE HIGH-WAIST FLARE TROUSER,289000,네이버,https://search.shopping.naver.com/gate.nhn?id=44106867835
410,FACE NONE LOGO DETAIL BIKE SHORTS,76000,네이버,https://search.shopping.naver.com/gate.nhn?id=44105735578
411,FACE NONE SKIRT LAYERED PANTS,286200,네이버,https://search.shopping.naver.com/gate.nhn?id=44041583391
412,FACE NONE FN SIGNATURE WOOL TAILORED PANTS,258000,네이버,https://search.shopping.naver.com/gate.nhn?id=44040535955
413,FACE NONE FN SIGNATURE WOOL TAILORED PANTS CAMEL,258000,네이버,https://search.shopping.naver.com/gate.nhn?id=44040080053
414,FACE NONE CRINKLED PANTS,198000,네이버,https://search.shopping.naver.com/gate.nhn?id=44038782278
415,FACE NONE GRAPHIC-PRINT FLARED PANTS MULTI COLOR,138000,네이버,https://search.shopping.naver.com/gate.nhn?id=44038209342
416,FACE NONE CRINKLED PANTS BUTTER,198000,네이버,https://search.shopping.naver.com/gate.nhn?id=44036590587
417,FACE NONE GRAPHIC-PRINT FLARED PANTS MULTI COLOR,138000,네이버,https://search.shopping.naver.com/gate.nhn?id=44036464888
418,FACE NONE FLARED PANTS SKY,268000,네이버,https://search.shopping.naver.com/gate.nhn?id=44018738670
419,FACE NONE NYLON FLARED TROUSERS,208000,네이버,https://search.shopping.naver.com/gate.nhn?id=43967487144
420,FACE NONE CUT-OUT TROUSER,248000,네이버,https://search.shopping.naver.com/gate.nhn?id=43967486971
421,FACE NONE CUT-OUT TROUSER,248000,네이버,https://search.shopping.naver.com/gate.nhn?id=43965358791
422,FACE NONE WIDE DENIM TROUSERS DEEP,289000,네이버,https://search.shopping.naver.com/gate.nhn?id=43964166845
423,FACE NONE NYLON FLARED TROUSERS GREEN,208000,네이버,https://search.shopping.naver.com/gate.nhn?id=43944498318
424,수지네 구제 차콜 슬랙스 여자 L none none,7410,옥션,https://search.shopping.naver.com/gate.nhn?id=45178743748
425,수지네 일본 구제 네이비 슬랙스 여자 S none none,7500,G마켓,https://search.shopping.naver.com/gate.nhn?id=45079726939
426,수지네 구제 블루 스트레이트팬츠 여자 XS none none,7420,G마켓,https://search.shopping.naver.com/gate.nhn?id=45079412288
427,수지네 구제 그레이 스트레이트팬츠 여자 S none none,7420,G마켓,https://search.shopping.naver.com/gate.nhn?id=45079613859
428,NIEEH WHOLE GARMENT KNIT HOODIE NONE,222000,네이버,https://search.shopping.naver.com/gate.nhn?id=44476091131
429,FACE NONE GRAPHIC-PRINT FLARED PANTS KAKHI MULTI COLOR,138000,네이버,https://search.shopping.naver.com/gate.nhn?id=44039120792
430,수지네 구제 차콜 슬랙스 여자 L none none,7420,G마켓,https://search.shopping.naver.com/gate.nhn?id=42343693818
431,여자 봄 가을 가죽 반바지 레그 여성 캐주얼 봄과 외부 NONE 바지 가,151600,네이버,https://search.shopping.naver.com/gate.nhn?id=37642920230
432,수지네 구제 다크블루 정장바지 여자 L none none,7410,옥션,https://search.shopping.naver.com/gate.nhn?id=45179184695
433,수지네 구제 블랙 면 카고바지 여자 S none none,8000,G마켓,https://search.shopping.naver.com/gate.nhn?id=45079504397
434,수지네 구제 다크블루 정장바지 여자 L none none,7420,G마켓,https://search.shopping.naver.com/gate.nhn?id=45079573885
435,MOHAE Wool half coat cream NONE,265000,네이버,https://search.shopping.naver.com/gate.nhn?id=45166131448
436,수지네 일본 구제 멀티컬러 스트레이트팬츠 여자 XS none none,7500,G마켓,https://search.shopping.naver.com/gate.nhn?id=45079660788
437,일리고 앙고라 반 바지 핑크  none,38800,쿠팡,https://search.shopping.naver.com/gate.nhn?id=44828210656
438,쓰리투에이티 DOODLE POCKET BANDING SHORTS 네이비  none,98310,쿠팡,https://search.shopping.naver.com/gate.nhn?id=45397618970
439,리엘 테리하프 스웨트 팬츠 민트체크  none,86100,쿠팡,https://search.shopping.naver.com/gate.nhn?id=45392975079
440,어나더에이 Flower Leopard 와이드 Pants  none,28740,쿠팡,https://search.shopping.naver.com/gate.nhn?id=45385308948
441,오호스 듀얼라이즈 지퍼 컨트롤 팬츠 바지 차콜  NONE,238700,쿠팡,https://search.shopping.naver.com/gate.nhn?id=45368267121
442,미드나잇무브 4 라인 팬츠 바지 블랙  NONE,83800,쿠팡,https://search.shopping.naver.com/gate.nhn?id=45367869552
443,일리고 앙고라 반 바지 민트  none,38800,쿠팡,https://search.shopping.naver.com/gate.nhn?id=45068447998
444,미드나잇무브 4 라인 팬츠 바지 브라운  NONE,83800,쿠팡,https://search.shopping.naver.com/gate.nhn?id=44538417674
445,수지네 일본 구제 차콜 면혼방 스키니팬츠 여자 M none none,8660,옥션,https://search.shopping.naver.com/gate.nhn?id=45081219293
446,수지네 구제 블랙 면혼방 스트레이트팬츠 여자 M 29 none none,7150,옥션,https://search.shopping.naver.com/gate.nhn?id=45080214409
447,수지네 구제 블랙 울혼방 스트레이트팬츠 여자 XS 23 none none,11620,G마켓,https://search.shopping.naver.com/gate.nhn?id=45080158341
448,수지네 구제 블랙 면혼방 스트레이트팬츠 여자 M 29 none none,7160,G마켓,https://search.shopping.naver.com/gate.nhn?id=45079645234
449,아방 AVANT-G Check Pleated Banding Skirt - none,44820,네이버,https://search.shopping.naver.com/gate.nhn?id=42678754629
450,에이리프 Kelly none collar leather jacket,194400,네이버,https://search.shopping.naver.com/gate.nhn?id=31177433638
451,블루브릭 BLUEBRICK Two-way short padding cream NONE,329000,네이버,https://search.shopping.naver.com/gate.nhn?id=44121857620
452,니트 브이넥 레트로 스트라이프 None 버튼 가디건236763,71300,네이버,https://search.shopping.naver.com/gate.nhn?id=44968861655
453,수지네 일본 구제 차콜 면혼방 스트레이트팬츠 여자 M 30 none none,17420,옥션,https://search.shopping.naver.com/gate.nhn?id=45179094648
454,수지네 일본 구제 황토색 면혼방 스트레이트팬츠 여자 M 30 none none,7150,옥션,https://search.shopping.naver.com/gate.nhn?id=45179052031
455,수지네 일본 구제 차콜 울혼방 스키니팬츠 여자 M 28 none none,7990,옥션,https://search.shopping.naver.com/gate.nhn?id=45178857660
456,수지네 일본 구제 차콜 면혼방 스키니팬츠 여자 M 27 none none,7150,옥션,https://search.shopping.naver.com/gate.nhn?id=45178950777
457,수지네 일본 구제 브라운 울혼방 스트레이트팬츠 여자 L 31 none none,7990,옥션,https://search.shopping.naver.com/gate.nhn?id=45080438103
458,수지네 일본 구제 브라운 면혼방 스키니팬츠 여자 XS 23 none none,7160,G마켓,https://search.shopping.naver.com/gate.nhn?id=45080404365
459,수지네 일본 구제 차콜 면혼방 스트레이트팬츠 여자 M 30 none none,17430,G마켓,https://search.shopping.naver.com/gate.nhn?id=45079684384
460,수지네 일본 구제 황토색 면혼방 스트레이트팬츠 여자 M 30 none none,7160,G마켓,https://search.shopping.naver.com/gate.nhn?id=45079678726
461,수지네 일본 구제 차콜 면혼방 스키니팬츠 여자 M 27 none none,7160,G마켓,https://search.shopping.naver.com/gate.nhn?id=45079601047
462,수지네 일본 구제 차콜 울혼방 정장바지 여자 L 31 none none,8000,G마켓,https://search.shopping.naver.com/gate.nhn?id=45079542365
463,ILLIGO 일리고 ANGORA LONG CARDIGAN MINT none,36000,네이버,https://search.shopping.naver.com/gate.nhn?id=44560631795
464,큐드로이 Qduroy Stripe Knit Sweater -Sky NONE,115200,네이버,https://search.shopping.naver.com/gate.nhn?id=42771666918
465,아방 AVANT-G Safari Fur Long Padding Jumper - NONE,159120,네이버,https://search.shopping.naver.com/gate.nhn?id=44393070287
466,[주르티]j1037 none collar jacekt (ivory),69615,더블유컨셉,https://search.shopping.naver.com/gate.nhn?id=39617517909
467,여성 캐주얼 슬림 사이즈 맞춤 제작하다 NONE 국내 여름 베이지 반바지,249770,소싱매니아,https://search.shopping.naver.com/gate.nhn?id=83156130438
468,23 S 마리 제인 캐시미어 스웨터 None B0060335686 SE0792023463968775SE0792023463968775,559000,네이버,https://search.shopping.naver.com/gate.nhn?id=40656146965
469,어나더에이 와일드 플라워 와이드 카고 팬츠 핑크  none,157900,쿠팡,https://search.shopping.naver.com/gate.nhn?id=45385285442
470,니트 브이넥 레트로 스트라이프 None 버튼 가디건236763,65100,네이버,https://search.shopping.naver.com/gate.nhn?id=44711557861
471,아방 AVANT-G Safari Fur Long Padding Jumper - NONE,159120,네이버,https://search.shopping.naver.com/gate.nhn?id=44377993089
472,수지네 일본 구제 그레이 울혼방 스트레이트팬츠 여자 M 27 none none,7990,옥션,https://search.shopping.naver.com/gate.nhn?id=45178981449
473,수지네 일본 구제 브라운 면혼방 부츠컷팬츠 여자 S none none,10870,G마켓,https://search.shopping.naver.com/gate.nhn?id=45078450074
474,수지네 구제 퍼플 면혼방 롱코트 여자 XS none none,25610,G마켓,https://search.shopping.naver.com/gate.nhn?id=45080472955
475,미드나잇무브 damage 니트 none,46980,네이버,https://search.shopping.naver.com/gate.nhn?id=43277314397
476,더센토르 CENTAUR NYLON JUMPER NONE,118800,네이버,https://search.shopping.naver.com/gate.nhn?id=42731914801
477,에이리프 Kelly none collar leather jacket,176904,네이버,https://search.shopping.naver.com/gate.nhn?id=31205908633
478,에이리프 Kelly none collar leather jacket,176904,네이버,https://search.shopping.naver.com/gate.nhn?id=31206218128
479,[주르티]j863 none collar jacket (grey),69615,더블유컨셉,https://search.shopping.naver.com/gate.nhn?id=39127117082
480,마가린핑거스 candy check blouse NONE,57760,네이버,https://search.shopping.naver.com/gate.nhn?id=45349360678
481,마가린핑거스 POINT FLOWER 니트 VEST none,54440,네이버,https://search.shopping.naver.com/gate.nhn?id=45347109100
482,A RIFF Kelly none collar leather jacket rva- c 552704,259700,네이버,https://search.shopping.naver.com/gate.nhn?id=43838602448
483,아더템포 에토 NONE,110295,네이버,https://search.shopping.naver.com/gate.nhn?id=45266699047
484,보헤미안 MATT LEATHER BIKER JACKET NONE,228000,네이버,https://search.shopping.naver.com/gate.nhn?id=45263372561
485,수지네 일본 구제 브라운 면혼방 부츠컷팬츠 여자 S none none,10860,옥션,https://search.shopping.naver.com/gate.nhn?id=43175696769
486,썸웨어버터 demi baguette bag butter cream none,109000,네이버,https://search.shopping.naver.com/gate.nhn?id=44758387591
487,아방 AVANT-G Fleece Wave Quilted Jumper - NONE,141520,네이버,https://search.shopping.naver.com/gate.nhn?id=44394147706
488,수지네 일본 구제 네이비 스트라이프 면혼방 7부팬츠 여자 M 28 none none,7150,옥션,https://search.shopping.naver.com/gate.nhn?id=45178845508
489,수지네 일본 구제 블랙 면혼방 부츠컷팬츠 여자 M 30 none none,7150,옥션,https://search.shopping.naver.com/gate.nhn?id=45080336847
490,수지네 구제 다크그레이 면혼방 7부팬츠 여자 L 32 none none,7150,옥션,https://search.shopping.naver.com/gate.nhn?id=45080356940
491,수지네 일본 구제 그레이 체크패턴 면혼방 스트레이트팬츠 여자 M 29 none none,7150,옥션,https://search.shopping.naver.com/gate.nhn?id=45080240893
492,수지네 일본 구제 블루 체크패턴 면혼방 스키니팬츠 여자 S 26 none none,17430,G마켓,https://search.shopping.naver.com/gate.nhn?id=45080440545
493,수지네 일본 구제 네이비 면혼방 부츠컷팬츠 여자 L 31 none none,7150,옥션,https://search.shopping.naver.com/gate.nhn?id=45080335783
494,수지네 일본 구제 다크그레이 면혼방 와이드팬츠 여자 M 29 none none,7160,G마켓,https://search.shopping.naver.com/gate.nhn?id=45079696886
495,수지네 일본 구제 네이비 면혼방 부츠컷팬츠 여자 L 31 none none,7160,G마켓,https://search.shopping.naver.com/gate.nhn?id=45079465145
496,수지네 구제 다크그레이 면혼방 7부팬츠 여자 L 32 none none,7160,G마켓,https://search.shopping.naver.com/gate.nhn?id=45079403547
497,수지네 일본 구제 블랙 면혼방 부츠컷팬츠 여자 M 30 none none,7160,G마켓,https://search.shopping.naver.com/gate.nhn?id=45079384956
498,NONE 뚱뚱함 이쁜이 MM 코디 핑크바지 빅사이즈 소프트 찰 9104S2606171239,19720,11번가,https://search.shopping.naver.com/gate.nhn?id=42566135770
499,ATTRAVER 와이앤알 니트 탑 그린 YNR KNIT TOP GREEN none,138580,네이버,https://search.shopping.naver.com/gate.nhn?id=33270062278
500,YUPPE 엽페 TAPE COLOR KNIT NONE,61200,네이버,https://search.shopping.naver.com/gate.nhn?id=38723156706
501,FACE NONE CROP BOLERO BOMBER JACKET,191800,네이버,https://search.shopping.naver.com/gate.nhn?id=40064698980
502,아방 AVANT-G Diamond Quilting Long Hood Jumper - KHAKI NONE,126990,네이버,https://search.shopping.naver.com/gate.nhn?id=44377388810
503,몸빼 바지 하렘 배기 반짝이 밴딩 팬츠 여성 빅사이즈 와이드 스팽글 - NONE,29420,티몬,https://search.shopping.naver.com/gate.nhn?id=44117601817
504,몸빼 바지 하렘 린넨 헐렁한 배기 팬츠 여성 빅사이즈 와이드 캐주얼 - NONE,34320,티몬,https://search.shopping.naver.com/gate.nhn?id=44117201286
505,몸빼 바지 하렘 동남아 배기 태국옷 팬츠 여성 빅사이즈 와이드 캐주얼 - NONE,23650,티몬,https://search.shopping.naver.com/gate.nhn?id=44115396583
506,EPINGLER NONE SIDE DENIM PANTS -,202400,네이버,https://search.shopping.naver.com/gate.nhn?id=44167105527
507,a riff Kelly none collar leather jacket,190100,네이버,https://search.shopping.naver.com/gate.nhn?id=43963529709
508,아방 AVANT-G Wave Quilting Hooded Jumper - DARG none,89640,네이버,https://search.shopping.naver.com/gate.nhn?id=42600850553
509,FACE NONE CROPPED KNIT SWEATER,238000,네이버,https://search.shopping.naver.com/gate.nhn?id=44041396554
510,썸웨어버터 SOMEWHEREBUTTER B logo cmere knit - NONE,109650,네이버,https://search.shopping.naver.com/gate.nhn?id=45396325809
511,수지네 일본 구제 멀티컬러 플라워패턴 면혼방 스키니팬츠 여자 M 29 none none,7150,옥션,https://search.shopping.naver.com/gate.nhn?id=45178870568
512,수지네 일본 구제 멀티컬러 플라워패턴 면혼방 스키니팬츠 여자 M 29 none none,7160,G마켓,https://search.shopping.naver.com/gate.nhn?id=45079442354
513,NONE 물건 여성 드롭 드레이프 와이드 루즈핏 일자통바지 15191035S2671500827,16110,11번가,https://search.shopping.naver.com/gate.nhn?id=42566541960
514,OEF Knit Mini Top Light NONE,110100,네이버,https://search.shopping.naver.com/gate.nhn?id=45347525405
515,썸웨어버터 Mix raglan pendant 니트 - cream NONE,119000,네이버,https://search.shopping.naver.com/gate.nhn?id=44426503043
516,막스마라 23 F W PAOLORE 더블 울 벨트 롱 코트 None B0060341223 SE0792023464132144SE0792023464132144,1464920,네이버,https://search.shopping.naver.com/gate.nhn?id=41458149386
517,하렘팬츠 여자 알라딘바지 시폰 시원한 요가 빅사이즈 바지 태국옷 - NONE,51350,티몬,https://search.shopping.naver.com/gate.nhn?id=44115337117
518,ANDNEEDS Collarless long coat charcoal NONE,459000,네이버,https://search.shopping.naver.com/gate.nhn?id=44395938082
519,FACE NONE STRAIGHT DENIM PANTS,168000,네이버,https://search.shopping.naver.com/gate.nhn?id=44374449254
520,LOVEUSU Big Collar Flip Raglan Cape Coat NONE,320000,네이버,https://search.shopping.naver.com/gate.nhn?id=44235988930
521,마가린핑거스 MARGARIN FINGERS RIBBON LEATHER BOMBER JACKET NONE,153730,네이버,https://search.shopping.naver.com/gate.nhn?id=42838530804
522,FACE NONE COTTON ROUND JACKET,318000,네이버,https://search.shopping.naver.com/gate.nhn?id=44126983083
523,FACE NONE LOVE STRAP DETAIL TERRY SKIRT,189000,네이버,https://search.shopping.naver.com/gate.nhn?id=44126597418
524,FACE NONE LOVE STRAP DETAIL TERRY SKIRT,189000,네이버,https://search.shopping.naver.com/gate.nhn?id=44124151603
525,FACE NONE FLARED DENIM PANTS,158000,네이버,https://search.shopping.naver.com/gate.nhn?id=44108049162
526,FACE NONE COTTON HALF SLEEVE SHIRTS,126000,네이버,https://search.shopping.naver.com/gate.nhn?id=44107315238
527,FACE NONE COTTON HALF SLEEVE SHIRTS,126000,네이버,https://search.shopping.naver.com/gate.nhn?id=44105903130
528,FACE NONE COTTON HALF SLEEVE SHIRTS,126000,네이버,https://search.shopping.naver.com/gate.nhn?id=44105874262
529,FACE NONE CP STRAIGHT JEANS,136000,네이버,https://search.shopping.naver.com/gate.nhn?id=44105072113
530,FACE NONE DAILY COTTON SHIRT,156000,네이버,https://search.shopping.naver.com/gate.nhn?id=44105083805
531,수지네 구제 레드 자켓 여자 L none none,10180,옥션,https://search.shopping.naver.com/gate.nhn?id=45179147172
532,수지네 일본 구제 차콜 자켓 여자 M none none,10940,옥션,https://search.shopping.naver.com/gate.nhn?id=45178867232
533,FACE NONE FN SIGNATURE BLAZER,408000,네이버,https://search.shopping.naver.com/gate.nhn?id=44043577080
534,FACE NONE SATIN MIDI SKIRT,168000,네이버,https://search.shopping.naver.com/gate.nhn?id=44043580900
535,FACE NONE SINGLE-BREASTED WRAP BLAZER,389000,네이버,https://search.shopping.naver.com/gate.nhn?id=44043571801
536,FACE NONE WIDE-LEG DENIM JEANS,168000,네이버,https://search.shopping.naver.com/gate.nhn?id=44042808144
537,FACE NONE SATIN MIDI SKIRT,168000,네이버,https://search.shopping.naver.com/gate.nhn?id=44042506759
538,FACE NONE FN SIGNATURE BLAZER,408000,네이버,https://search.shopping.naver.com/gate.nhn?id=44042048787
539,FACE NONE CROPPED BOMBER JACKET,236000,네이버,https://search.shopping.naver.com/gate.nhn?id=44041224861
540,FACE NONE CROPPED JACKET,236000,네이버,https://search.shopping.naver.com/gate.nhn?id=44040910400
541,FACE NONE MERINO WOOL CROPPED CARDIGAN,289000,네이버,https://search.shopping.naver.com/gate.nhn?id=44039124154
542,FACE NONE MOHAIR-BLEND BRUSHED V-NECK KNIT,256000,네이버,https://search.shopping.naver.com/gate.nhn?id=44039031563
543,FACE NONE ROLL-NECK SWEATER,318000,네이버,https://search.shopping.naver.com/gate.nhn?id=44038896681
544,FACE NONE CROPPED BOMBER JACKET CHARCOAL,236000,네이버,https://search.shopping.naver.com/gate.nhn?id=44038653982
545,FACE NONE ZIP-UP BOMBER JACKET CHARCOAL,258000,네이버,https://search.shopping.naver.com/gate.nhn?id=44038302242
546,FACE NONE WOOL FAUX LEATHER MINI SKIRT,238000,네이버,https://search.shopping.naver.com/gate.nhn?id=44038223228
547,FACE NONE OPEN-KNIT BUTTON-UP CARDIGAN,329000,네이버,https://search.shopping.naver.com/gate.nhn?id=44038252810
548,FACE NONE MERINO WOOL CROPPED CARDIGAN,289000,네이버,https://search.shopping.naver.com/gate.nhn?id=44038246317
